<!DOCTYPE document SYSTEM "document.dtd">

<document>
  <title>よしだむの秘密のページ</title>

  <para>
  よしだむの秘密のページにようこそ☆
  </para>
  <para>
  このページは HTML4.0，CSS 1.0 に準拠した Web ブラウザで閲覧することを
  お勧めします。
  </para>

  <index>
    <link xml:link="simple" href="/">[bekkoame ホームページ]</link>
  </index>


  <section>
    <heading>更新情報</heading>
    <subsection>
      <heading>1998/07/08</heading>
      <list>
        <item>XML2HTML でページを生成するようにしました</item>
        <item>Ruby ページで XMLParser モジュールと Uconv モジュールの公開
        を始めました</item>
      </list>
    </subsection>
  </section>


  <section id="hobby">
    <heading>趣味</heading>
   <subsection id="ruby">
      <heading><link xml:link="simple" href="Ruby.html">♪Ruby</link></heading>
      <para>最近は Ruby なのです。</para>
    </subsection>

    <subsection id="xml">
      <heading><link xml:link="simple" href="XML.html">♪XML</link></heading>
      <para>XML もやってます。</para>
      <list>
        <item>
          <link xml:link="simple" href="index.xml">このページのソース 
            (XML)</link>
        </item>
        <item>
          <link xml:link="simple" href="document.dtd">このページの DTD</link>
        </item>
        <item>
          <link xml:link="simple" href="document.css">このページのスタイル
          シート</link>
        </item>
      </list>
    </subsection>
  </section>

  <section id="misc">
    <heading>その他のページ</heading>
    <list>
      <item><link xml:link="simple" href="http://www.cipuco.net/">
	CIPUCO!!</link></item>
    </list>
  </section>

  <rpara>
      Copyright 1998 by
	<link xml:link="simple" href="mailto:yoshidam@yoshidam.net">
	  Yoshida Masato (yoshidam@yoshidam.net)</link>
  </rpara>
</document>
